{
  "schemaVersion": "1.0.0",
  "id": "13-week-olympic-lifting-base-cycle",
  "name": "13 Week Olympic Lifting Base Cycle",
  "discipline": "olympic-lifting",
  "description": "Example workout plan using week/day structure with percentage-based, absolute, and target-based prescriptions.",
  "referenceMaxes": [
    {
      "key": "snatch_1rm",
      "exerciseName": "Snatch",
      "value": 100,
      "unit": "kg"
    },
    {
      "key": "clean_and_jerk_1rm",
      "exerciseName": "Clean & Jerk",
      "value": 125,
      "unit": "kg"
    },
    {
      "key": "back_squat_1rm",
      "exerciseName": "Back Squat",
      "value": 180,
      "unit": "kg"
    },
    {
      "key": "press_1rm",
      "exerciseName": "Press",
      "value": 80,
      "unit": "kg"
    }
  ],
  "weeks": [
    {
      "index": 1,
      "label": "Week 1",
      "days": [
        {
          "index": 1,
          "code": "w1d1",
          "exercises": [
            {
              "name": "Hang Snatch",
              "prescriptions": [
                {
                  "type": "set-rep",
                  "sets": 1,
                  "reps": 3,
                  "load": {
                    "type": "percentage",
                    "unit": "%",
                    "reference": "snatch_1rm",
                    "operator": "exact",
                    "value": 50
                  }
                },
                {
                  "type": "set-rep",
                  "sets": 1,
                  "reps": 3,
                  "load": {
                    "type": "percentage",
                    "unit": "%",
                    "reference": "snatch_1rm",
                    "operator": "exact",
                    "value": 60
                  }
                },
                {
                  "type": "set-rep",
                  "sets": 4,
                  "reps": 3,
                  "load": {
                    "type": "percentage",
                    "unit": "%",
                    "reference": "snatch_1rm",
                    "operator": "exact",
                    "value": 70
                  }
                }
              ]
            },
            {
              "name": "Snatch Extension",
              "prescriptions": [
                {
                  "type": "set-rep",
                  "sets": 3,
                  "reps": 5,
                  "load": {
                    "type": "percentage",
                    "unit": "%",
                    "reference": "snatch_1rm",
                    "operator": "exact",
                    "value": 80
                  }
                }
              ]
            },
            {
              "name": "Back Squat",
              "prescriptions": [
                {
                  "type": "set-rep",
                  "sets": 1,
                  "reps": 5,
                  "load": {
                    "type": "percentage",
                    "unit": "%",
                    "reference": "back_squat_1rm",
                    "operator": "exact",
                    "value": 50
                  }
                },
                {
                  "type": "set-rep",
                  "sets": 1,
                  "reps": 5,
                  "load": {
                    "type": "percentage",
                    "unit": "%",
                    "reference": "back_squat_1rm",
                    "operator": "exact",
                    "value": 60
                  }
                },
                {
                  "type": "set-rep",
                  "sets": 3,
                  "reps": 5,
                  "load": {
                    "type": "percentage",
                    "unit": "%",
                    "reference": "back_squat_1rm",
                    "operator": "exact",
                    "value": 70
                  }
                }
              ]
            },
            {
              "name": "Press",
              "prescriptions": [
                {
                  "type": "target",
                  "goal": {
                    "type": "sets-reps",
                    "sets": 3,
                    "reps": 5
                  },
                  "notes": "Work up to a technically solid load."
                }
              ]
            }
          ]
        },
        {
          "index": 2,
          "code": "w1d2",
          "exercises": [
            {
              "name": "Hang Clean",
              "prescriptions": [
                {
                  "type": "set-rep",
                  "sets": 1,
                  "reps": 3,
                  "load": {
                    "type": "percentage",
                    "unit": "%",
                    "reference": "clean_and_jerk_1rm",
                    "operator": "exact",
                    "value": 50
                  }
                },
                {
                  "type": "set-rep",
                  "sets": 1,
                  "reps": 3,
                  "load": {
                    "type": "percentage",
                    "unit": "%",
                    "reference": "clean_and_jerk_1rm",
                    "operator": "exact",
                    "value": 60
                  }
                },
                {
                  "type": "set-rep",
                  "sets": 4,
                  "reps": 3,
                  "load": {
                    "type": "percentage",
                    "unit": "%",
                    "reference": "clean_and_jerk_1rm",
                    "operator": "exact",
                    "value": 70
                  }
                }
              ]
            },
            {
              "name": "Jerk",
              "prescriptions": [
                {
                  "type": "set-rep",
                  "sets": 1,
                  "reps": 3,
                  "load": {
                    "type": "percentage",
                    "unit": "%",
                    "reference": "clean_and_jerk_1rm",
                    "operator": "exact",
                    "value": 40
                  }
                },
                {
                  "type": "set-rep",
                  "sets": 1,
                  "reps": 3,
                  "load": {
                    "type": "percentage",
                    "unit": "%",
                    "reference": "clean_and_jerk_1rm",
                    "operator": "exact",
                    "value": 50
                  }
                },
                {
                  "type": "set-rep",
                  "sets": 1,
                  "reps": 3,
                  "load": {
                    "type": "percentage",
                    "unit": "%",
                    "reference": "clean_and_jerk_1rm",
                    "operator": "exact",
                    "value": 60
                  }
                },
                {
                  "type": "set-rep",
                  "sets": 4,
                  "reps": 3,
                  "load": {
                    "type": "percentage",
                    "unit": "%",
                    "reference": "clean_and_jerk_1rm",
                    "operator": "exact",
                    "value": 70
                  }
                }
              ]
            },
            {
              "name": "Weighted Pull-Up",
              "notes": "Absolute-load example that is useful beyond olympic lifting.",
              "prescriptions": [
                {
                  "type": "set-rep",
                  "sets": 5,
                  "reps": 5,
                  "load": {
                    "type": "absolute",
                    "value": 15,
                    "unit": "kg"
                  }
                }
              ]
            }
          ]
        }
      ]
    },
    {
      "index": 2,
      "label": "Week 2",
      "days": [
        {
          "index": 1,
          "code": "w2d1",
          "exercises": [
            {
              "name": "Hang Snatch",
              "prescriptions": [
                {
                  "type": "set-rep",
                  "sets": 1,
                  "reps": 3,
                  "load": {
                    "type": "percentage",
                    "unit": "%",
                    "reference": "snatch_1rm",
                    "operator": "exact",
                    "value": 40
                  }
                },
                {
                  "type": "set-rep",
                  "sets": 1,
                  "reps": 3,
                  "load": {
                    "type": "percentage",
                    "unit": "%",
                    "reference": "snatch_1rm",
                    "operator": "exact",
                    "value": 50
                  }
                },
                {
                  "type": "set-rep",
                  "sets": 1,
                  "reps": 3,
                  "load": {
                    "type": "percentage",
                    "unit": "%",
                    "reference": "snatch_1rm",
                    "operator": "exact",
                    "value": 60
                  }
                },
                {
                  "type": "set-rep",
                  "sets": 5,
                  "reps": 3,
                  "load": {
                    "type": "percentage",
                    "unit": "%",
                    "reference": "snatch_1rm",
                    "operator": "at-least",
                    "value": 70
                  }
                }
              ]
            },
            {
              "name": "Press",
              "prescriptions": [
                {
                  "type": "target",
                  "goal": {
                    "type": "rep-max",
                    "repMax": 5
                  },
                  "notes": "Alternative target-based instruction if the program calls for a work-up set."
                }